{
  "schema_version": "prc.agent-output/v0.1",
  "task_id": "32ba99edc36712a6202f63830dfd540162145c9becd28fa42cfcadc050f11008",
  "status": "candidate",
  "root_cause": "The target behavior has no regression coverage.",
  "changed_files": ["app_test.go"],
  "patch": "diff --git a/app_test.go b/app_test.go\nnew file mode 100644\n--- /dev/null\n+++ b/app_test.go\n@@ -0,0 +1,9 @@\n+package app\n+\n+import \"testing\"\n+\n+func TestReady(t *testing.T) {\n+\tif !Ready() {\n+\t\tt.Fatal(\"Ready returned false\")\n+\t}\n+}\n",
  "commands_requested_or_run": [],
  "limitations": ["The proposal has not been applied or verified."],
  "requested_capability_changes": []
}
